{"artifact_index_sha256":"88cf8b6a5ad08f42ac27ee4e10d5e1f46a03a304d6ebbfdc1dd774811d635043","candidate_input_rows":[],"candidate_input_schema":{"additionalProperties":false,"properties":{"conclusion_id":{"type":"string"},"phase3b_usable":{"const":true}},"required":["conclusion_id","phase3b_usable"],"type":"object"},"change_point_coverage":[{"status":"Unknown-unrun","tier":"A","version":"2.1.214"},{"status":"Unknown-unrun","tier":"A","version":"2.1.212"},{"status":"Unknown-unrun","tier":"A","version":"2.1.211"},{"status":"Unknown-unrun","tier":"A","version":"2.1.208"},{"status":"Unknown-unrun","tier":"A","version":"2.1.207"}],"contradiction_ids":[],"exit_report_path":"docs/superpowers/evidence/phase3a/phase-3a-exit-report.json","exit_report_sha256":"7540852a9a2c3f59e1c74455c35282479bc0907633fe2ab442b5c40dc336813f","negative_capabilities":["no-cch","no-change-points","no-compact","no-dual-source","no-messages-request","no-sse","no-system-prompt","no-tls","no-usable-conclusions"],"omitted_cells":[{"cell":"active-messages-baseline","reason":"six safe repetitions reached stable HEAD-only failure before messages coverage"},{"cell":"environment-system-prompt-matrix","reason":"active messages baseline not reproducible"},{"cell":"telemetry-lifecycle-stream-compact","reason":"active messages baseline not reproducible"},{"cell":"tier-a-change-points","reason":"P3A-3 waits for reproducible active baseline"},{"cell":"tier-b-change-points","reason":"Tier B yields to unresolved active and Tier A gates"},{"cell":"windows-linux","reason":"no isolated worker available"}],"p2":{"bundle_sha256":"2545113fb928131ee5a735541b5373a00566b279263aca5b1cc11181aaf78bce","predecessor_sha256":"70c26db06e9135db31d08f097573e3fd55bd9a8894614832eefeecabf6b1a3d1","schema_range":"1:0-0"},"platform_coverage":[{"messages_request":"Unknown","observed":"HEAD-root-only","platform":"darwin-arm64","status":"BLOCKED","version":"2.1.215"}],"runtime_enforcement_implemented":false,"schema_version":"oracle-lab-phase3a-handoff.v1","status":"BLOCKED","unknown_conclusion_ids":["CL-P3A-ACTIVE-BASELINE-UNKNOWN","CL-P3A-CHANGE-POINTS-UNKNOWN","CL-P3A-STATIC-ENTRY-UNKNOWN"],"usable_conclusion_ids":[]}
